{
  "$schema": "https://tabnas.github.io/measure/schemas/port-result.schema.json",
  "schemaVersion": 1,
  "run": {
    "id": "20260823T010344421Z-suite-0.1.0-ed810a27",
    "generatedAt": "2026-08-23T01:03:44.421Z",
    "profile": "full",
    "suiteVersion": "0.1.0",
    "repositoryCommit": "ed810a2761f16b6d96e6dfca7c3062c4f18d0e5f",
    "repositoryDirty": false
  },
  "port": {
    "id": "typescript",
    "label": "TypeScript / Node.js",
    "language": "TypeScript",
    "runtime": "Node.js",
    "runtimeVersion": "v24.14.1",
    "parserModule": "@tabnas/parser",
    "parserVersion": "0.9.0"
  },
  "environment": {
    "fingerprint": "59e2714e366f9ff55d992f901ced12c8fedf080721c8ae86bdde1fc27ddf88ae",
    "os": "linux",
    "arch": "amd64",
    "cpu": "Intel(R) Core(TM) m3-6Y30 CPU @ 0.90GHz",
    "logicalCpus": 4,
    "memoryBytes": 8219103232,
    "hostname": "inch"
  },
  "methodology": {
    "scope": "parse-only-steady-state-sequential",
    "warmupMs": 250,
    "sampleTargetMs": 100,
    "samples": 11,
    "maxIterations": 1048576
  },
  "capabilities": [
    {
      "benchmarkId": "adder",
      "passed": 7,
      "total": 7,
      "cases": [
        {
          "caseId": "single",
          "description": "One number is a complete expression.",
          "acceptExpected": true,
          "accepted": true,
          "passed": true,
          "expected": 1,
          "actual": 1
        },
        {
          "caseId": "chain",
          "description": "Three terms accumulate on the parent node.",
          "acceptExpected": true,
          "accepted": true,
          "passed": true,
          "expected": 6,
          "actual": 6
        },
        {
          "caseId": "multi-digit",
          "description": "Multi-digit number tokens retain their numeric values.",
          "acceptExpected": true,
          "accepted": true,
          "passed": true,
          "expected": 60,
          "actual": 60
        },
        {
          "caseId": "trailing-plus",
          "description": "A plus sign must be followed by another number.",
          "acceptExpected": false,
          "accepted": false,
          "passed": true,
          "error": "[tabnas/unexpected]: unexpected character(s): "
        },
        {
          "caseId": "leading-plus",
          "description": "An expression cannot begin with plus.",
          "acceptExpected": false,
          "accepted": false,
          "passed": true,
          "error": "[tabnas/unexpected]: unexpected character(s): +"
        },
        {
          "caseId": "double-plus",
          "description": "An empty term between plus signs is rejected.",
          "acceptExpected": false,
          "accepted": false,
          "passed": true,
          "error": "[tabnas/unexpected]: unexpected character(s): +"
        },
        {
          "caseId": "unknown-token",
          "description": "Unrecognized arithmetic syntax is rejected.",
          "acceptExpected": false,
          "accepted": false,
          "passed": true,
          "error": "[tabnas/unexpected]: unexpected character(s): *2"
        }
      ]
    },
    {
      "benchmarkId": "palindrome",
      "passed": 9,
      "total": 9,
      "cases": [
        {
          "caseId": "empty",
          "description": "The empty word belongs to the language.",
          "acceptExpected": true,
          "accepted": true,
          "passed": true,
          "expected": true,
          "actual": true
        },
        {
          "caseId": "pair-a",
          "description": "The smallest a palindrome is accepted.",
          "acceptExpected": true,
          "accepted": true,
          "passed": true,
          "expected": true,
          "actual": true
        },
        {
          "caseId": "pair-b",
          "description": "The smallest b palindrome is accepted.",
          "acceptExpected": true,
          "accepted": true,
          "passed": true,
          "expected": true,
          "actual": true
        },
        {
          "caseId": "nested",
          "description": "Nested unlike symbols match across the midpoint.",
          "acceptExpected": true,
          "accepted": true,
          "passed": true,
          "expected": true,
          "actual": true
        },
        {
          "caseId": "length-six",
          "description": "A three-symbol first half is mirrored.",
          "acceptExpected": true,
          "accepted": true,
          "passed": true,
          "expected": true,
          "actual": true
        },
        {
          "caseId": "odd-length",
          "description": "No midpoint between symbols exists.",
          "acceptExpected": false,
          "accepted": false,
          "passed": true,
          "error": "[tabnas/unexpected]: unexpected character(s): a"
        },
        {
          "caseId": "not-mirrored",
          "description": "Equal-length halves that are not reverses fail.",
          "acceptExpected": false,
          "accepted": false,
          "passed": true,
          "error": "[tabnas/unexpected]: unexpected character(s): a"
        },
        {
          "caseId": "wrong-close",
          "description": "A close symbol that differs from its opener fails.",
          "acceptExpected": false,
          "accepted": false,
          "passed": true,
          "error": "[tabnas/unexpected]: unexpected character(s): b"
        },
        {
          "caseId": "outside-alphabet",
          "description": "Symbols outside the declared alphabet are rejected.",
          "acceptExpected": false,
          "accepted": false,
          "passed": true,
          "error": "[tabnas/unexpected]: unexpected character(s): c"
        }
      ]
    }
  ],
  "measurements": [
    {
      "benchmarkId": "adder",
      "caseId": "terms-8",
      "description": "Eight one-digit terms.",
      "input": {
        "bytes": 15,
        "codeUnits": 15,
        "sha256": "93510957d0c117e488d63e3abdce2abc73faa01fe090b0ef129ec6c4be068184"
      },
      "iterationsPerSample": 1024,
      "samples": [
        {
          "elapsedNs": 207707271
        },
        {
          "elapsedNs": 47539360
        },
        {
          "elapsedNs": 47165388
        },
        {
          "elapsedNs": 47048070
        },
        {
          "elapsedNs": 47099971
        },
        {
          "elapsedNs": 46602639
        },
        {
          "elapsedNs": 51770740
        },
        {
          "elapsedNs": 47012255
        },
        {
          "elapsedNs": 53424210
        },
        {
          "elapsedNs": 46708600
        },
        {
          "elapsedNs": 43791038
        }
      ],
      "checksum": 90112
    },
    {
      "benchmarkId": "adder",
      "caseId": "terms-64",
      "description": "Sixty-four one-digit terms.",
      "input": {
        "bytes": 127,
        "codeUnits": 127,
        "sha256": "91e79a93823fd4218f182177fb3bbdecb8e83356a0841b940accff1474901641"
      },
      "iterationsPerSample": 512,
      "samples": [
        {
          "elapsedNs": 340179279
        },
        {
          "elapsedNs": 210605465
        },
        {
          "elapsedNs": 288364574
        },
        {
          "elapsedNs": 154778151
        },
        {
          "elapsedNs": 166789951
        },
        {
          "elapsedNs": 172484344
        },
        {
          "elapsedNs": 166006426
        },
        {
          "elapsedNs": 173063740
        },
        {
          "elapsedNs": 156525023
        },
        {
          "elapsedNs": 151087328
        },
        {
          "elapsedNs": 153015969
        }
      ],
      "checksum": 360448
    },
    {
      "benchmarkId": "adder",
      "caseId": "terms-512",
      "description": "Five hundred twelve one-digit terms.",
      "input": {
        "bytes": 1023,
        "codeUnits": 1023,
        "sha256": "c6973089da125bc7162b53db8e8e6fa05cd62ce89ff873f197625ab4c08bf194"
      },
      "iterationsPerSample": 64,
      "samples": [
        {
          "elapsedNs": 326551314
        },
        {
          "elapsedNs": 135944915
        },
        {
          "elapsedNs": 181232137
        },
        {
          "elapsedNs": 185706223
        },
        {
          "elapsedNs": 190701359
        },
        {
          "elapsedNs": 147473081
        },
        {
          "elapsedNs": 141812576
        },
        {
          "elapsedNs": 147463792
        },
        {
          "elapsedNs": 146998871
        },
        {
          "elapsedNs": 146972979
        },
        {
          "elapsedNs": 149340771
        }
      ],
      "checksum": 360448
    },
    {
      "benchmarkId": "adder",
      "caseId": "terms-4096",
      "description": "Four thousand ninety-six one-digit terms.",
      "input": {
        "bytes": 8191,
        "codeUnits": 8191,
        "sha256": "8f007725257384c4d2bcfcc22f6c4ce2448ed1ba98b9c1c19ceb601284759cc7"
      },
      "iterationsPerSample": 8,
      "samples": [
        {
          "elapsedNs": 412382103
        },
        {
          "elapsedNs": 200775126
        },
        {
          "elapsedNs": 144754966
        },
        {
          "elapsedNs": 152566660
        },
        {
          "elapsedNs": 140007075
        },
        {
          "elapsedNs": 141001981
        },
        {
          "elapsedNs": 142498484
        },
        {
          "elapsedNs": 145959858
        },
        {
          "elapsedNs": 143578216
        },
        {
          "elapsedNs": 168821918
        },
        {
          "elapsedNs": 205511621
        }
      ],
      "checksum": 360448
    },
    {
      "benchmarkId": "palindrome",
      "caseId": "chars-16",
      "description": "Sixteen-character even palindrome.",
      "input": {
        "bytes": 16,
        "codeUnits": 16,
        "sha256": "79b7d7e507283611608710c2521a2eed17b17e69cd3a234b5d221e9a50b1913d"
      },
      "iterationsPerSample": 2048,
      "samples": [
        {
          "elapsedNs": 240123695
        },
        {